{
  "id": "7fbd5d84-62d1-44c6-9c45-6cb173998bbd",
  "title": "Bridget Jones's Baby",
  "alternativeTitles": ["First alternative title", 
                        "Second alternative title"],
  "identifiers": [
    { 
      "typeId": "7f907515-a1bf-4513-8a38-92e1a07c539d",
      "value": "B01LHE7MIU"
    }
  ],
  "creators": [
    {
      "creatorTypeId": "2e48e713-17f3-7c13-09f8-23845bb210aa",
      "name": "Creator A"
    },
    {
      "creatorTypeId": "e8b311a6-3b21-03f2-2269-dd9310cb2d0a",
      "name": "Creator B"
    }
  ],
  "contributors": [
    {
      "contributorTypeId": "2b94c631-fca9-a892-c730-03ee529ffe2b",
      "name": "Contributor 1"
    },
    {
      "contributorTypeId": "2e48e713-17f3-7c13-09f8-23845bb210ab",
      "name": "Contributor 2"
    }
  ],
  "publication": [
    {
      "publisher": "University of Oxford",
      "place": "UK",
      "dateOfPublication": "2017"
    },
    {
      "publisher": "Cambridge University Press",
      "place": "UK",
      "dateOfPublication": "2014"
    }
  ]
}
